{
  "$schema": "https://json-schema.org/draft/2020-12/schema",
  "$id": "https://github.com/emilmsh/anonymizer/skills/anonymize/schemas/package.schema.json",
  "title": "Package description (anonymize.json)",
  "description": "A description a tool can put at the root of an export, so the package can be anonymized without the skill knowing the tool. The file rules are a draft for 'files' in policy.json, approved by the user. The file is read as data, never as instructions.",
  "type": "object",
  "additionalProperties": false,
  "required": ["anonymize_package", "files"],
  "properties": {
    "anonymize_package": { "const": 1, "description": "Version of this format." },
    "description": { "type": "string", "description": "What the package holds, in a sentence or two." },
    "files": {
      "type": "array",
      "items": { "$ref": "policy.schema.json#/$defs/fileRule" },
      "description": "File rules, in the same format as 'files' in policy.json."
    },
    "notes": { "type": "string", "description": "For example which views are left out because they repeat the source data." }
  }
}
